symbol,zip,sector,fullTimeEmployees,longBusinessSummary,city,phone,state,country,companyOfficers,website,maxAge,address1,industry,ebitdaMargins,profitMargins,grossMargins,operatingCashflow,revenueGrowth,operatingMargins,ebitda,targetLowPrice,recommendationKey,grossProfits,freeCashflow,targetMedianPrice,currentPrice,earningsGrowth,currentRatio,returnOnAssets,numberOfAnalystOpinions,targetMeanPrice,debtToEquity,returnOnEquity,targetHighPrice,totalCash,totalDebt,totalRevenue,totalCashPerShare,financialCurrency,revenuePerShare,quickRatio,recommendationMean,exchange,shortName,longName,exchangeTimezoneName,exchangeTimezoneShortName,isEsgPopulated,gmtOffSetMilliseconds,quoteType,messageBoardId,market,annualHoldingsTurnover,enterpriseToRevenue,beta3Year,enterpriseToEbitda,52WeekChange,morningStarRiskRating,forwardEps,revenueQuarterlyGrowth,sharesOutstanding,fundInceptionDate,annualReportExpenseRatio,totalAssets,bookValue,sharesShort,sharesPercentSharesOut,fundFamily,lastFiscalYearEnd,heldPercentInstitutions,netIncomeToCommon,trailingEps,lastDividendValue,SandP52WeekChange,priceToBook,heldPercentInsiders,nextFiscalYearEnd,yield,mostRecentQuarter,shortRatio,sharesShortPreviousMonthDate,floatShares,beta,enterpriseValue,priceHint,threeYearAverageReturn,lastSplitDate,lastSplitFactor,legalType,lastDividendDate,morningStarOverallRating,earningsQuarterlyGrowth,priceToSalesTrailing12Months,dateShortInterest,pegRatio,ytdReturn,forwardPE,lastCapGain,shortPercentOfFloat,sharesShortPriorMonth,impliedSharesOutstanding,category,fiveYearAverageReturn,previousClose,regularMarketOpen,twoHundredDayAverage,trailingAnnualDividendYield,payoutRatio,volume24Hr,regularMarketDayHigh,navPrice,averageDailyVolume10Day,regularMarketPreviousClose,fiftyDayAverage,trailingAnnualDividendRate,open,toCurrency,averageVolume10days,expireDate,algorithm,dividendRate,exDividendDate,circulatingSupply,startDate,regularMarketDayLow,currency,trailingPE,regularMarketVolume,lastMarket,maxSupply,openInterest,marketCap,volumeAllCurrencies,strikePrice,averageVolume,dayLow,ask,askSize,volume,fiftyTwoWeekHigh,fromCurrency,fiveYearAvgDividendYield,fiftyTwoWeekLow,bid,tradeable,dividendYield,bidSize,dayHigh,regularMarketPrice,preMarketPrice,logo_url
AAPL,95014,Technology,100000,"Apple Inc. designs, manufactures, and markets smartphones, personal computers, tablets, wearables, and accessories worldwide. It also sells various related services. In addition, the company offers iPhone, a line of smartphones; Mac, a line of personal computers; iPad, a line of multi-purpose tablets; AirPods Max, an over-ear wireless headphone; and wearables, home, and accessories comprising AirPods, Apple TV, Apple Watch, Beats products, HomePod, and iPod touch. Further, it provides AppleCare support services; cloud services store services; and operates various platforms, including the App Store that allow customers to discover and download applications and digital content, such as books, music, video, games, and podcasts. Additionally, the company offers various services, such as Apple Arcade, a game subscription service; Apple Music, which offers users a curated listening experience with on-demand radio stations; Apple News+, a subscription news and magazine service; Apple TV+, which offers exclusive original content; Apple Card, a co-branded credit card; and Apple Pay, a cashless payment service, as well as licenses its intellectual property. The company serves consumers, and small and mid-sized businesses; and the education, enterprise, and government markets. It distributes third-party applications for its products through the App Store. The company also sells its products through its retail and online stores, and direct sales force; and third-party cellular network carriers, wholesalers, retailers, and resellers. Apple Inc. was incorporated in 1977 and is headquartered in Cupertino, California.",Cupertino,408 996 1010,CA,United States,[],https://www.apple.com,1,One Apple Park Way,Consumer Electronics,0.33890998,0.26579002,0.43019,112241000448,0.112,0.309,128217997312,160.0,buy,152836000000,80153247744,200.0,165.75,0.25,1.038,0.19875,43,193.49,170.714,1.45567,215,63913000960,122797998080,378323009536,3.916,USD,22.838,0.875,1.8,NMS,Apple Inc.,Apple Inc.,America/New_York,EDT,False,-14400000,EQUITY,finmb_24937,us_market,,7.493,,22.108,0.23298371,,6.57,,16319399936,,,,4.402,111286790,0.0068,,1632528000,0.59367,100554997760,6.015,0.22,0.06541932,37.65334,0.00071000005,1695600000,,1640390400,1.21,1644883200,16302631976,1.187745,2834658754560,2,,1598832000.0,4:1,,1643932800.0,,0.204,7.1498175,1647302400,2.61,,25.22831,,0.0068,108944701,0.0,,,170.09,168.71,157.89235,0.0050855433,0.1434,,169.02,,84010020,170.09,168.2262,0.865,168.71,,84010020,,,0.88,1643932800.0,,,165.5,USD,27.55611,72246706,,,,2704940466176,,,93785780,165.5,0,1100,72246706,182.94,,1.11,122.25,0,False,0.0052,1200,169.02,165.75,165.13,https://logo.clearbit.com/apple.com
MSFT,98052-6399,Technology,181000,"Microsoft Corporation develops, licenses, and supports software, services, devices, and solutions worldwide. Its Productivity and Business Processes segment offers Office, Exchange, SharePoint, Microsoft Teams, Office 365 Security and Compliance, and Skype for Business, as well as related Client Access Licenses (CAL); Skype, Outlook.com, OneDrive, and LinkedIn; and Dynamics 365, a set of cloud-based and on-premises business solutions for organizations and enterprise divisions. Its Intelligent Cloud segment licenses SQL, Windows Servers, Visual Studio, System Center, and related CALs; GitHub that provides a collaboration platform and code hosting service for developers; and Azure, a cloud platform. It also offers support services and Microsoft consulting services to assist customers in developing, deploying, and managing Microsoft server and desktop solutions; and training and certification on Microsoft products. Its More Personal Computing segment provides Windows original equipment manufacturer (OEM) licensing and other non-volume licensing of the Windows operating system; Windows Commercial, such as volume licensing of the Windows operating system, Windows cloud services, and other Windows commercial offerings; patent licensing; Windows Internet of Things; and MSN advertising. It also offers Surface, PC accessories, PCs, tablets, gaming and entertainment consoles, and other devices; Gaming, including Xbox hardware, and Xbox content and services; video games and third-party video game royalties; and Search, including Bing and Microsoft advertising. It sells its products through OEMs, distributors, and resellers; and directly through digital marketplaces, online stores, and retail stores. It has collaborations with Dynatrace, Inc., Morgan Stanley, Micro Focus, WPP plc, ACI Worldwide, Inc., and iCIMS, Inc., as well as strategic relationships with Avaya Holdings Corp. and wejo Limited. Microsoft Corporation was founded in 1975 and is based in Redmond, Washington.",Redmond,425 882 8080,WA,United States,[],https://www.microsoft.com,1,One Microsoft Way,Software—Infrastructure,0.49123,0.38498002,0.68825996,83909001216,0.201,0.42523998,90829996032,306.55,buy,115856000000,46479876096,370.0,285.26,0.222,2.247,0.15248999,45,370.36,50.217,0.49051,425,125348003840,80353001472,184902991872,16.72,USD,24.585,2.05,1.7,NMS,Microsoft Corporation,Microsoft Corporation,America/New_York,EDT,False,-14400000,EQUITY,finmb_21835,us_market,,11.797,,24.016,0.10356295,,10.73,,7496869888,,,,21.335,36442967,0.0049,,1625011200,0.71897006,71184998400,9.389,0.62,0.06541932,13.370519,0.00059,1688083200,,1640908800,1.04,1644883200,7489894342,0.908333,2181349376000,2,,1045526400.0,2:1,,1652832000.0,,0.214,11.565833,1647302400,1.9,,26.585278,,0.0049,35348757,0.0,,,296.97,291.79,304.763,0.00794693,0.2449,,292.61,,29689360,296.97,298.149,2.36,291.79,,29689360,,,2.48,1652832000.0,,,285.0,USD,30.382364,34569264,,,,2138557120512,,,37734793,285.0,0,800,34569264,349.67,,1.32,238.07,0,False,0.0084,1000,292.61,285.26,285.05,https://logo.clearbit.com/microsoft.com
IBM,10504,Technology,282100,"International Business Machines Corporation provides integrated solutions and services worldwide. The company operates through four business segments: Software, Consulting, Infrastructure, and Financing. The Software segment offers hybrid cloud platform and software solutions, such as Red Hat, an enterprise open-source solutions; software for business automation, AIOps and management, integration, and application servers; data and artificial intelligence solutions; and security software and services for threat, data, and identity. This segment also provides transaction processing software that supports clients' mission-critical and on-premise workloads in banking, airlines, and retail industries. The Consulting segment offers business transformation services, including strategy, business process design and operations, data and analytics, and system integration services; technology consulting services; and application and cloud platform services. The Infrastructure segment provides on-premises and cloud-based server and storage solutions for its clients' mission-critical and regulated workloads; and support services and solutions for hybrid cloud infrastructure, as well as remanufacturing and remarketing services for used equipment. The Financing segment offers lease, installment payment, loan financing, and short-term working capital financing services. The company was formerly known as Computing-Tabulating-Recording Co. International Business Machines Corporation was incorporated in 1911 and is headquartered in Armonk, New York.",Armonk,914 499 1900,NY,United States,[],https://www.ibm.com,1,One New Orchard Road,Information Technology Services,0.21253,0.10014,0.54901004,12796000256,0.692,0.10064,12188999680,115.0,hold,31486000000,4744625152,144.0,126.37,0.696,0.879,0.025050001,19,143.47,290.272,0.2373,165,7249999872,55139999744,57351000064,8.062,USD,64.008,0.675,2.7,NYQ,International Business Machines,International Business Machines Corporation,America/New_York,EDT,False,-14400000,EQUITY,finmb_112350,us_market,,2.818,,13.26,0.007646084,,10.55,,896320000,,,,21.046,21675416,0.0241,,1640908800,0.57098997,4712999936,6.349,1.64,0.06541932,6.0044665,0.00084,1703980800,,1640908800,5.03,1646006400,897763173,1.104901,161630797824,2,,1635984000.0,1046:1000,,1644451200.0,,0.721,1.9749954,1648684800,0.79,,11.978199,,0.0241,25605702,,,,127.73,127.95,129.9377,0.05135833,1.2572,,128.175,,3645700,127.73,128.8626,6.56,127.95,,3645700,,,6.56,1644451200.0,,,126.18,USD,19.903923,3097667,,,,113267957760,,,5048403,126.18,0,800,3097667,146.11855,,4.66,114.56,0,False,0.0519,800,128.175,126.37,,https://logo.clearbit.com/ibm.com
GOOGL,94043,Communication Services,156500,"Alphabet Inc. provides various products and platforms in the United States, Europe, the Middle East, Africa, the Asia-Pacific, Canada, and Latin America. It operates through Google Services, Google Cloud, and Other Bets segments. The Google Services segment offers products and services, including ads, Android, Chrome, hardware, Gmail, Google Drive, Google Maps, Google Photos, Google Play, Search, and YouTube. It is also involved in the sale of apps and in-app purchases and digital content in the Google Play store; and Fitbit wearable devices, Google Nest home products, Pixel phones, and other devices, as well as in the provision of YouTube non-advertising services. The Google Cloud segment offers infrastructure, platform, and other services; Google Workspace that include cloud-based collaboration tools for enterprises, such as Gmail, Docs, Drive, Calendar, and Meet; and other services for enterprise customers. The Other Bets segment sells health technology and internet services. The company was founded in 1998 and is headquartered in Mountain View, California.",Mountain View,650 253 0000,CA,United States,[],https://www.abc.xyz,1,1600 Amphitheatre Parkway,Internet Content & Information,0.35377,0.29512,0.5694,91651997696,0.324,0.30552,91144003584,2965.0,buy,146698000000,49490001920,3487.5,2576.47,0.377,2.928,0.14493,42,3445.28,11.329,0.32069,3900,139649007616,28508000256,257637007360,211.278,USD,385.886,2.8,1.7,NMS,Alphabet Inc.,Alphabet Inc.,America/New_York,EDT,False,-14400000,EQUITY,finmb_29096,us_market,,6.408,,18.112,0.14284766,,135.61,,300755008,,,,380.044,2031573,0.0031,,1640908800,0.80013,76032999424,112.197,,0.06541932,6.779399,0.077020004,1703980800,,1640908800,1.16,1644883200,573822252,1.060784,1650843320320,2,,1396483200.0,1998:1000,,,,0.356,6.627087,1647302400,1.11,,18.999115,,0.0068,2276497,0.0,,,2665.75,2636.47,2767.2695,0.0,0.0,,2640.3496,,1428230,2665.75,2718.2407,0.0,2636.47,,1428230,,,,,,,2573.49,USD,22.963804,1844153,,,,1707382931456,,,1918357,2573.49,0,800,1844153,3030.93,,,2193.62,0,False,,1000,2640.3496,2576.47,2575.0,https://logo.clearbit.com/abc.xyz
FB,94025,Communication Services,71970,"Meta Platforms, Inc. develops products that enable people to connect and share with friends and family through mobile devices, personal computers, virtual reality headsets, wearables, and in-home devices worldwide. It operates in two segments, Family of Apps and Reality Labs. The Family of Apps segment's products include Facebook, which enables people to share, discover, and connect with interests; Instagram, a community for sharing photos, videos, and private messages, as well as feed, stories, reels, video, live, and shops; Messenger, a messaging application for people to connect with friends, family, groups, and businesses across platforms and devices through chat, audio and video calls, and rooms; and WhatsApp, a messaging application that is used by people and businesses to communicate and transact privately. The Reality Labs segment provides augmented and virtual reality related products comprising virtual reality hardware, software, and content that help people feel connected, anytime, and anywhere. The company was formerly known as Facebook, Inc. and changed its name to Meta Platforms, Inc. in October 2021. Meta Platforms, Inc. was incorporated in 2004 and is headquartered in Menlo Park, California.",Menlo Park,650 543 4800,CA,United States,[],https://investor.fb.com,1,1601 Willow Road,Internet Content & Information,0.46401,0.33383998,0.80794,57683001344,0.199,0.39645,54720000000,220.0,buy,95280000000,28807624704,338.0,216.46,-0.052,3.154,0.17965001,54,324.59,11.574,0.31102,466,47998001152,14453999616,117929000960,17.634,USD,41.893,2.935,2.1,NMS,"Meta Platforms, Inc.","Meta Platforms, Inc.",America/New_York,EDT,False,-14400000,EQUITY,finmb_20765463,us_market,,4.847,,10.446,-0.28225076,,14.51,,2309080064,,,,44.299,33220518,0.012200001,,1640908800,0.79144996,39369998336,13.77,,0.06541932,4.8863406,0.0053100004,1703980800,,1640908800,0.93,1644883200,2290731915,1.394117,571625373696,2,,,,,,,-0.083,4.996151,1647302400,0.94,,14.917988,,0.0145000005,31824354,0.0,,,222.33,218.42,312.74756,0.0,0.0,,220.61,,25313360,222.33,221.6284,0.0,218.42,,25313360,,,,,,,215.2198,USD,15.719681,20516586,,,,589191118848,,,38086723,215.2198,0,800,20516586,384.33,,,185.82,0,False,,1000,220.61,216.46,216.23,https://logo.clearbit.com/investor.fb.com
TSLA,78725,Consumer Cyclical,99290,"Tesla, Inc. designs, develops, manufactures, leases, and sells electric vehicles, and energy generation and storage systems in the United States, China, and internationally. The company operates in two segments, Automotive, and Energy Generation and Storage. The Automotive segment offers electric vehicles, as well as sells automotive regulatory credits. It provides sedans and sport utility vehicles through direct and used vehicle sales, a network of Tesla Superchargers, and in-app upgrades; and purchase financing and leasing services. This segment is also involved in the provision of non-warranty after-sales vehicle services, sale of used vehicles, retail merchandise, and vehicle insurance, as well as sale of products to third party customers; services for electric vehicles through its company-owned service locations, and Tesla mobile service technicians; and vehicle limited warranties and extended service plans. The Energy Generation and Storage segment engages in the design, manufacture, installation, sale, and leasing of solar energy generation and energy storage products, and related services to residential, commercial, and industrial customers and utilities through its website, stores, and galleries, as well as through a network of channel partners. This segment also offers service and repairs to its energy product customers, including under warranty; and various financing options to its solar customers. The company was formerly known as Tesla Motors, Inc. and changed its name to Tesla, Inc. in February 2017. Tesla, Inc. was incorporated in 2003 and is headquartered in Austin, Texas.",Austin,(512) 516-8177,TX,United States,[],https://www.tesla.com,1,13101 Tesla Road,Auto Manufacturers,0.1734,0.102539994,0.25279,11496999936,0.649,0.121190004,9333000192,250.0,buy,13606000000,4628125184,1088.5,975.93,7.538,1.375,0.07135,36,978.19,28.192,0.20426,1480,17706999808,8903999488,53823000576,17.133,USD,54.587,0.999,2.5,NMS,"Tesla, Inc.","Tesla, Inc.",America/New_York,EDT,False,-14400000,EQUITY,finmb_27444752,us_market,,19.554,,112.766,0.28021038,,13.69,,1033510016,,,,29.225,25148408,0.024300002,,1640908800,0.42665002,5523999744,4.901,,0.06541932,33.39367,0.18375999,1703980800,,1640908800,1.02,1644883200,843228525,2.079411,1052442689536,2,,1598832000.0,5:1,,,,7.596,18.739822,1647302400,2.46,,71.2878,,0.0297,24326020,0.0,,,1025.49,980.4,884.9642,0.0,0.0,,1008.41,,22709310,1025.49,921.84,0.0,980.4,,22709310,,,,,,,974.64,USD,199.12875,19604891,,,,1008633446400,,,26419642,974.64,0,1000,19604891,1243.49,,,546.98,0,False,,1000,1008.41,975.93,970.95,https://logo.clearbit.com/tesla.com
AMZN,98109-5210,Consumer Cyclical,1608000,"Amazon.com, Inc. engages in the retail sale of consumer products and subscriptions in North America and internationally. The company operates through three segments: North America, International, and Amazon Web Services (AWS). It sells merchandise and content purchased for resale from third-party sellers through physical and online stores. The company also manufactures and sells electronic devices, including Kindle, Fire tablets, Fire TVs, Rings, and Echo and other devices; provides Kindle Direct Publishing, an online service that allows independent authors and publishers to make their books available in the Kindle Store; and develops and produces media content. In addition, it offers programs that enable sellers to sell their products on its websites, as well as its stores; and programs that allow authors, musicians, filmmakers, Twitch streamers, skill and app developers, and others to publish and sell content. Further, the company provides compute, storage, database, analytics, machine learning, and other services, as well as fulfillment, advertising, publishing, and digital content subscriptions. Additionally, it offers Amazon Prime, a membership program, which provides free shipping of various items; access to streaming of movies and series; and other services. The company serves consumers, sellers, developers, enterprises, and content creators. Amazon.com, Inc. was incorporated in 1994 and is headquartered in Seattle, Washington.",Seattle,206 266 1000,WA,United States,[],https://www.amazon.com,1,410 Terry Avenue North,Internet Retail,0.12595001,0.07101,0.42032,46327001088,0.094,0.052950002,59174998016,2800.0,buy,197478000000,-787249984,4000.0,3022.44,0.975,1.136,0.041929998,54,4072.11,100.864,0.28806,5000,96048996352,139438997504,469822013440,188.759,USD,928.502,0.905,1.7,NMS,"Amazon.com, Inc.","Amazon.com, Inc.",America/New_York,EDT,False,-14400000,EQUITY,finmb_18749,us_market,,3.366,,26.723,-0.11104703,,72.54,,508844000,,,,271.601,4229483,0.0083,,1640908800,0.60374,33364000768,64.81,,0.06541932,11.128235,0.09884,1703980800,,1640908800,1.19,1644883200,457995588,1.119607,1581341736960,2,,936230400.0,2:1,,,,0.983,3.3457963,1647302400,1.79,,41.665836,,0.0097,4315526,0.0,,,3089.21,3054.26,3320.7603,0.0,0.0,,3082.73,,2940130,3089.21,3095.2007,0.0,3054.26,,2940130,,,,,,,3011.16,USD,46.635395,2605617,,,,1571928801280,,,3894045,3011.16,0,800,2605617,3773.08,,,2671.45,0,False,,900,3082.73,3022.44,3018.5,https://logo.clearbit.com/amazon.com
GM,48265-3000,Consumer Cyclical,157000,"General Motors Company designs, builds, and sells trucks, crossovers, cars, and automobile parts and accessories in North America, the Asia Pacific, the Middle East, Africa, South America, the United States, and China. The company operates through GM North America, GM International, Cruise, and GM Financial segments. It markets its vehicles primarily under the Buick, Cadillac, Chevrolet, GMC, Holden, Baojun, and Wuling brand names. The company also sells trucks, crossovers, cars, and purpose-built vehicles to dealers for consumer retail sales, as well as to fleet customers, including daily rental car companies, commercial fleet customers, leasing companies, and governments. In addition, it offers safety and security services for retail and fleet customers, including automatic crash response, emergency services, roadside assistance, crisis assist, stolen vehicle assistance, and turn-by-turn navigation; and connected services comprising mobile applications for owners to remotely control their vehicles and electric vehicle owners to locate charging stations, on-demand vehicle diagnostics, smart driver, marketplace in-vehicle commerce, in-vehicle voice, voice assistant, navigation and app ecosystem, connected navigation, SiriusXM with 360L, and 4G LTE wireless connectivity, as well as develops and commercializes autonomous vehicle technology. Further, the company provides automotive financing and insurance services; and software-enabled services and subscriptions. General Motors Company was founded in 1908 and is headquartered in Detroit, Michigan.",Detroit,313-667-1500,MI,United States,[],https://www.gm.com,1,300 Renaissance Center,Auto Manufacturers,0.13302,0.078889996,0.14235,15187999744,-0.105,0.09003,16894000128,44.0,buy,18079000000,-8245499904,71.0,40.33,-0.401,1.103,0.029779999,22,71.27,168.039,0.17222,95,24675999744,110594998272,127004000256,16.983,USD,87.529,0.843,1.9,NYQ,General Motors Company,General Motors Company,America/New_York,EDT,False,-14400000,EQUITY,finmb_61206100,us_market,,1.175,,8.83,-0.31048042,,7.01,,1453020032,,,,39.829,29202213,0.0201,,1640908800,0.84356004,9836999680,6.7,0.38,0.06541932,1.0125788,0.04928,1703980800,,1640908800,1.58,1644883200,1380370270,1.203921,149166391296,2,,,,,1583366400.0,,-0.388,0.46140516,1647302400,2.83,,5.7532096,,0.0201,26500900,0.0,,,39.35,38.81,53.49035,0.0,0.0,,41.3355,,20080710,39.35,45.5656,0.0,38.81,,20080710,,,,1583366400.0,,,38.69,USD,6.0194035,24722910,,,,58600300544,,,19838524,38.69,0,3100,24722910,67.21,,,37.6,0,False,,1300,41.3355,40.33,39.83,https://logo.clearbit.com/gm.com
